{"base_site":{"path":"/srv/sparkinterval-operator/site/azure-cpu-materializer-site.json","sha256":"0000000000000000000000000000000000000000000000000000000000000000","size_bytes":0},"kind":"sparkinterval.azure.cpu.platt-head-materializer-site.v1","platt_head":{"flint_source_root":"/srv/sparkinterval-source/flint-3.6.0","python_flint_source_root":"/srv/sparkinterval-source/python-flint-0.9.0","python_flint_wheel":{"path":"/srv/sparkinterval-source/python_flint-0.9.0-cp310-abi3-manylinux2014_x86_64.manylinux_2_17_x86_64.whl","sha256":"376b88cacd30612479e839ffdba887599d3f9c8c0e214852bf80bb2b194e4d76","size_bytes":10125938}},"schema_version":1}
